"וילה טרה קוטה וילות במעונה 10 חדרי שינה או יותר 11 יחידות נופש מפוארות, בריכת שחייה מהנה, שולחנות משחק, פינת מנגל ועוד פינוקים. למידע נוסף 052-9708199"
"וילה אנדראה וילות בצפת 7 חדרי שינה וילה אנדראה מזמינה אתכם לאירוח מפנק במתחם יוקרתי עם 7 חדרי שינה, בריכת זרמים, ג'קוזי ספא.. למידע נוסף 052-9129094"
"חושן הייטס וילות בספסופה 8 חדרי שינה וילה יוקרתית עם 8 חדרי שינה, 7 חדרי רחצה, בריכת שחייה מחוממת ומקורה, ג'קוזי ספא ועוד! למידע נוסף 052-9127065"
"וילה דרך היער וילות בראש פינה 4 חדרי שינה 4 חדרי שינה יוקרתיים, 4 חדרי רחצה, בריכת שחייה מהנה, שולחן פינג פונג ועוד מגוון אטרקציות.    למידע נוסף 052-9708006"
"וילה פרובנס וילות במנות 9 חדרי שינה 8 חדרי שינה ורחצה מאובזרים למשפחות וקבוצות, בריכה גדולה, פינת גזיבו, מנגל ועוד אטרקציות. למידע נוסף 052-9708162"
"וילה חלומות אלה וילות בחצור הגלילית 5 חדרי שינה 5 חדרי שינה מפנקים, 4 חדרי רחצה, בריכה מחוממת, ג'קוזי, שולחנות משחק ועוד פינוקים.    למידע נוסף 052-9128610"
"וילה טריפל וילות במגדל 10 חדרי שינה או יותר מתחם מפנק במגדל עם 3 וילות, 15 חדרי שינה יוקרתיים, 15 חדרי רחצה מעוצבים, 3 בריכות שחייה למידע נוסף 052-9708703"
"וילה לורנס וילות במנחמיה 7 חדרי שינה וילה יוקרתית במנחמיה עם 7 חדרי שינה מפנקים, בריכת שחייה ובריכת זרמים הצופים לנוף עוצר נשימה! למידע נוסף 052-9122334"
"וילה אירופה וילות בכלנית 4 חדרי שינה וילה אירופה, וילה מפנקת בכלנית, בעלת 6 חדרי שינה מתוכן 2 חדרי גלרייה. למידע נוסף 052-9787748"
"וילה אחוזת נתיב וילות בנטועה 7 חדרי שינה 7 חדרי שינה, בריכת שחייה גדולה, מיני קאנטרי למשפחות זוגות וקבוצות, אווירה פסטורלית ורגועה. למידע נוסף 052-9708163"
"אחוזת מרלו וילות בדלתון 7 חדרי שינה אחוזת מרלו מציעה לאורחיה- 7 חדרי שינה מפוארים, בריכת שחייה ענקית מול נוף ועוד. למידע נוסף 052-9708184"
"וילה אריסטו וילות באליפלט 5 חדרי שינה וילה יוקרתית עם 5 חדרי שינה, מתוכם 2 סוייטות, בריכת שחייה, ג'קוזי, שולחנות משחק ועוד אטרקציות.    למידע נוסף 052-9171152"
"וילה רקפת וילות בטבריה 7 חדרי שינה וילה רקפת היוקרתית מזמינה אתכם לחופשה מהנה בטבריה עם נוף עוצר נשימה, בריכת שחייה פרטית. למידע נוסף 052-9096296"
"מתחם מובחר בכפר וילות בשדה אליעזר 9 חדרי שינה מתחם וילה וסוויטות מפנקות שבשדה אליעזר עם בריכת שחייה גדולה, ג'קוזי ספא, שולחן סנוקר ועוד. למידע נוסף 052-9126381"
"וילה הדבר האמיתי וילות בעין יעקב 6 חדרי שינה 4 חדרי שינה + 2 סוויטות VIP ושפע פינוקים לציבור הדתי, קבוצות זוגות ומשפחות. למידע נוסף 052-9708159"
"וילה מורנה וילות בראש פינה 10 חדרי שינה או יותר אחוזת בוטיק יוקרתית עם 8 סוויטות נופש, 2 בריכות, נוף עוצר נשימה למשפחות אירועים ועוד פינוקים. למידע נוסף 052-9788866"
וילה לה וידה וילות במגדל 5 חדרי שינה וילה לה וידה המפוארת שבמגדל מזמינה אתכם לאירוח מפנק ב- 5 חדרי שינה ועוד המון! למידע נוסף 052-9708150
"וילה ונילה וילות בשתולה 10 חדרי שינה או יותר וילה למשפחות ומסיבות הכוללת 10 חדרים ושפע אטרקציות כמו: בריכה מחוממת, ג'קוזי ספא, ועוד! למידע נוסף 052-9708108"
"אחוזת שושנים בוטיק וילות בשומרה 4 חדרי שינה 4  חדרי שינה, 4 חדרי רחצה, בריכת שחייה, ג'קוזי ספא ועוד שפע פינוקים ואטרקציות.    למידע נוסף 052-9121136"
"וילת עידן הנוף וילות ביערה 6 חדרי שינה 6 חדרי שינה, מתוכם 2 סוויטות, ג'קוזי ספא מענג חושים, בריכת שחייה מהנה ועוד פינוקים. למידע נוסף 052-9123432"
דה קיז (The Kee's) וילות בחוסן 6 חדרי שינה מתחם נופש יוקרתי ומפנק עם 6 חדרי שינה המתאים ללינה עד 18 נופשים. למידע נוסף 052-9124432
"וילה J וילות במגדל 7 חדרי שינה מתחם נופש יוקרתי ביישוב מגדל המציע וילה עם 5 חדרי שינה, 2 צימרים ועוד שפע פינוקים.    למידע נוסף 052-9128310"
"בלו סקיי וילה וילות בנוף כנרת 5 חדרי שינה וילה עם בריכת שחייה גדולה מחוממת ומקורה, עמדת מנגל,  ג'קוזי ספא, 5 חדרי שינה מעוצבים ועוד! למידע נוסף 052-9127932"
"אחוזת אמור וילות בספסופה 4 חדרי שינה וילה עם 4 חדרי שינה, בריכת שחייה מהנה, שולחנות משחק, ג'קוזי ספא ועוד שפע אטרקציות. למידע נוסף 052-9170216"
"וילה רויאל סאן וילות בעין יעקב 6 חדרי שינה וילה יקורתית ביישוב עין יעקב המציעה 6 חדרי שינה, בריכת שחייה מחוממת ועוד מגוון הפתעות ופינוקים. למידע נוסף 052-9121108"
"וילות סוף הדרך ימינה וילות בחצור הגלילית 4 חדרי שינה 4 חדרי שינה, בכל וילה בריכת שחייה, סנוקר, פינת מנגל ועוד למשפחות. למידע נוסף 052-9126363"
